{
  "registry_version": "1.1",
  "name": "The Rest of US",
  "updated": "2026-10-14",
  "profile_schema": "./profiles/schema.json",
  "circles": {
    "feed": "./circles/index.json",
    "schema": "./circles/schema.json",
    "submit": {
      "repository": "rest-of-us/job-circles",
      "branch": "main",
      "path": "circles/entries"
    }
  },
  "peers": [],
  "hubs": [
    {
      "id": "uk",
      "name": "UK & Ireland",
      "region": "uk",
      "description": "Senior engineers, architects and technical leaders based in the United Kingdom and Ireland.",
      "repository": "https://github.com/rest-of-us/hub-uk",
      "profiles_url": "https://rest-of-us.github.io/hub-uk/profiles.json",
      "timezones": [
        "UTC",
        "UTC+1"
      ],
      "status": "planned",
      "submit": {
        "repository": "rest-of-us/hub-uk",
        "branch": "main",
        "path": "profiles"
      }
    },
    {
      "id": "canada",
      "name": "Canada",
      "region": "canada",
      "description": "Senior tech talent across Canada, from Vancouver to Halifax.",
      "repository": "https://github.com/rest-of-us/hub-canada",
      "profiles_url": "https://rest-of-us.github.io/hub-canada/profiles.json",
      "timezones": [
        "UTC-8",
        "UTC-7",
        "UTC-6",
        "UTC-5",
        "UTC-4",
        "UTC-3:30"
      ],
      "status": "planned",
      "submit": {
        "repository": "rest-of-us/hub-canada",
        "branch": "main",
        "path": "profiles"
      }
    },
    {
      "id": "latam",
      "name": "Latin America",
      "region": "latam",
      "description": "Senior engineers across Mexico, Central and South America, with strong overlap with North American hours.",
      "repository": "https://github.com/rest-of-us/hub-latam",
      "profiles_url": "https://rest-of-us.github.io/hub-latam/profiles.json",
      "timezones": [
        "UTC-6",
        "UTC-5",
        "UTC-4",
        "UTC-3"
      ],
      "status": "planned",
      "submit": {
        "repository": "rest-of-us/hub-latam",
        "branch": "main",
        "path": "profiles"
      }
    },
    {
      "id": "apac",
      "name": "Asia-Pacific",
      "region": "apac",
      "description": "Senior tech talent across India, Southeast Asia, Australia and New Zealand.",
      "repository": "https://github.com/rest-of-us/hub-apac",
      "profiles_url": "https://rest-of-us.github.io/hub-apac/profiles.json",
      "timezones": [
        "UTC+5:30",
        "UTC+7",
        "UTC+8",
        "UTC+9",
        "UTC+10",
        "UTC+12"
      ],
      "status": "planned",
      "submit": {
        "repository": "rest-of-us/hub-apac",
        "branch": "main",
        "path": "profiles"
      }
    },
    {
      "id": "community",
      "name": "Community (all regions)",
      "region": "global",
      "description": "Profiles from regions whose hub isn't open yet. Each one moves to its regional hub when that hub launches.",
      "repository": "https://github.com/rest-of-us/job-circles",
      "profiles_url": "profiles/community.json",
      "timezones": [],
      "status": "active",
      "always_open": true,
      "submit": {
        "repository": "rest-of-us/job-circles",
        "branch": "main",
        "path": "profiles/community"
      }
    },
    {
      "id": "demo",
      "name": "Demo hub (sample data)",
      "region": "europe",
      "description": "Fictional sample profiles that show the profile format. Not real candidates.",
      "repository": "https://github.com/rest-of-us/job-circles",
      "profiles_url": "profiles/demo.json",
      "timezones": [],
      "status": "demo"
    }
  ]
}
